{"$schema":"https://json-schema.org/draft/2020-12/schema","type":"array","items":{"type":"object","required":["id","category","title","value","unit","context","date","verifiedAt","source","backupEvidence","status","featured"],"properties":{"id":{"type":"string"},"category":{"enum":["chess","product","client-work","music"]},"title":{"type":"string"},"value":{"type":"string"},"unit":{"type":"string"},"context":{"type":"string"},"date":{"type":"string"},"verifiedAt":{"type":"string"},"source":{"type":"object"},"backupEvidence":{"type":["string","null"]},"status":{"enum":["verified","self-reported","expired"]},"featured":{"type":"boolean"}},"additionalProperties":false}}

